зяином квартиры;Z59.2;59528
10059461;Проблема конфликта с членами семьи;Z63.8;59529
10059462;Проблема конфликта с членами семьи уточненная;Z63.9;59530
10059463;Проблема кормления;R63.3;59531
10059464;Проблема кормления новорожденного;P92.9;59532
10059465;Проблема кормления новорожденного грудью;P92.5;59533
10059466;Проблема кормления новорожденного уточненная;P92.8;59534
10059467;Проблема кормления новорожденного, вялое сосание;P92.2;59535
10059468;Проблема кормления новорожденного, медленное сосание;P92.2;59536
10059469;Проблема кормления новорожденного, недокармливание;P92.3;59537
10059470;Проблема кормления новорожденного, перекармливание;P92.4;59538
10059471;Проблема курения табака;Z72.0;59539
10059472;Проблема медицинских учреждений;Z75.9;59540
10059473;Проблема медицинских учреждений уточненная;Z75.8;59541
10059474;Проблема медицинской помощи в семье;Z63.6;59542
10059475;Проблема медицинской помощи уточненная;Z75.8;59543
10059476;Проблема многодетности;Z64.1;59544
10059477;Проблема мочевая;N39.9;59545
10059478;Проблема нарушенной способности к передвижению вследствие длительного пребывания в постели;R26.3;59546
10059479;Проблема нарушенной способности передвигаться;Z74.0;59547
10059480;Проблема нарушенной способности передвигаться, требующая оказания помощи;Z74.0;59548
10059481;Проблема насилия по отношению к ребенку;Z61.6;59549
10059482;Проблема неадекватного обучения;Z55.8;59550
10059483;Проблема неблагоприятных жизненных событий в детстве;Z61.9;59551
10059484;Проблема неблагоприятных жизненных событий в детстве, уточненное событие;Z61.8;59552
10059485;Проблема неврологическая;R29.8;59553
10059486;Проблема неграмотности;Z55.0;59554
10059487;Проблема нежелательной беременности;Z64.0;59555
10059488;Проблема неприемлемого давления со стороны родителей;Z62.6;59556
10059489;Проблема несоблюдения личной гигиены;Z91.2;59557
10059490;Проблема неспособности к обучению;F81.9;59558
10059491;Проблема неспособности к обучению вследствие нарушения процесса развития;F81.9;59559
10059492;Проблема нетипичных ситуаций между родителями и детьми;Z60.1;59560
10059493;Проблема неудобного графика работы;Z56.3;59561
10059494;Проблема неудовлетворенности работой;Z56.7;59562
10059495;Проблема неудовлетворенности школьной обстановкой;Z55.4;59563
10059496;Проблема неудовлетворительных жилищных условий;Z59.9;59564
10059497;Проблема неудовлетворительных жилищных условий другая уточненная;Z59.8;59565
10059498;Проблема неуспеваемости в школе;Z55.3;59566
10059499;Проблема низкого уровня грамотности;Z55.0;59567
10059500;Проблема образа жизни;Z72.9;59568
10059501;Проблема ограниченности жилой площади;Z59.1;59569
10059502;Проблема одиночества;Z60.2;59570
10059503;Проблема освобождения из тюрьмы;Z65.2;59571
10059504;Проблема отклонения в состоянии плода, требующего предоставления медицинской помощи матери;O36.9;59572
10059505;Проблема отлучения от дома в детстве;Z61.1;59573
10059506;Проблема отлучения от дома, влияние на ребенка;Z61.1;59574
10059507;Проблема отсутствия жилища;Z59.0;59575
10059508;Проблема отсутствия работы;Z56.0;59576
10059509;Проблема пережитого испуга в детстве;Z61.7;59577
10059510;Проблема пищеварения;K92.9;59578
10059511;Проблема плохого лечения;Z91.8;59579
10059512;Проблема плохого преподавания;Z55.8;59580
10059513;Проблема поведения, сопряженного с самоповреждением;Z72.8;59581
10059514;Проблема поиска и принятия известных вредных и опасных алиментарных вмешательств;Z64.2;59582
10059515;Проблема поиска и принятия известных вредных и опасных поведенческих воздействий;Z64.3;59583
10059516;Проблема поиска и принятия известных вредных и опасных психологических воздействий;Z64.3;59584
10059517;Проблема поиска и принятия известных вредных и опасных физических вмешательств;Z64.2;59585
10059518;Проблема поиска и принятия известных вредных и опасных химических вмешательств;Z64.2;59586
10059519;Проблема политической дискриминации;Z60.5;59587
10059520;Проблема половой дискриминации;Z60.5;59588
10059521;Проблема половой функции;F52.9;59589
10059522;Проблема половой функции неорганическая;F52.9;59590
10059523;Проблема помещения ребенка в закрытое учреждение, влияющее на ребенка;Z62.2;59591
10059524;Проблема потери аппетита;F50.8;59592
10059525;Проблема потери любимого родственника в детстве;Z61.0;59593
10059526;Проблема потери права выкупа заложенного имущества;Z59.8;59594
10059527;Проблема потери самоуважения в детстве;Z61.3;59595
10059528;Проблема появления в семье мачехи влияющее на ребенка;Z61.2;59596
10059529;Проблема появления в семье отчима влиющее на ребенка;Z61.2;59597
10059530;Проблема правовая;Z65.3;59598
10059531;Проблема признания виновности судом;Z65.0;59599
10059532;Проблема признания виновности судом и тюремного заключения;Z65.1;59600
10059533;Проблема принятия другой культуры;Z60.3;59601
10059534;Проблема присутствия в доме больного;Z63.7;59602
10059535;Проблема присутствия в доме больного, нуждающегося в уходе;Z63.6;59603
10059536;Проблема присутствия в доме инвалида;Z63.7;59604
10059537;Проблема присутствия в доме инвалида, нуждающегося в уходе;Z63.6;59605
10059538;Проблема присутствия в семье больного;Z63.7;59606
10059539;Проблема присутствия в семье больного, нуждающегося в уходе;Z63.6;59607
10059540;Проблема присутствия в семье инвалида;Z63.7;59608
10059541;Проблема присутствия в семье инвалида, нуждающегося в уходе;Z63.6;59609
10059542;Проблема психиатрическая;F99;59610
10059543;Проблема психосексуального развития;F66.9;59611
10059544;Проблема психосоциальная;Z65.9;59612
10059545;Проблема психосоциальная уточненная;Z65.8;59613
10059546;Проблема развода, приведшего к распаду семьи;Z63.5;59614
10059547;Проблема разногласий в семье;Z63.8;59615
10059548;Проблема разногласий между супругами;Z63.0;59616
10059549;Проблема разногласий между супругами с разводом;Z63.5;59617
10059550;Проблема разногласий с должностным лицом, надзирающим за испытуемым;Z64.4;59618
10059551;Проблема разногласий с начальником;Z56.4;59619
10059552;Проблема разногласий с партнером;Z63.0;59620
10059553;Проблема разногласий с попечителем;Z64.4;59621
10059554;Проблема разногласий с поручителем;Z64.4;59622
10059555;Проблема разногласий с поручителем официальным;Z64.4;59623
10059556;Проблема разногласий с постояльцами;Z59.2;59624
10059557;Проблема разногласий с работодателем;Z56.4;59625
10059558;Проблема разногласий с родителями жены;Z63.1;59626
10059559;Проблема разногласий с родителями мужа;Z63.1;59627
10059560;Проблема разногласий с родственниками жены;Z63.1;59628
10059561;Проблема разногласий с родственниками мужа;Z63.1;59629
10059562;Проблема разногласий с семьей;Z63.8;59630
10059563;Проблема разногласий с советником;Z64.4;59631
10059564;Проблема разногласий с соседями;Z59.2;59632
10059565;Проблема разногласий с сослуживцами;Z56.4;59633
10059566;Проблема разногласий с соучениками;Z55.4;59634
10059567;Проблема разногласий с социальным работником;Z64.4;59635
10059568;Проблема разногласий с супругом;Z63.0;59636
10059569;Проблема разногласий с товарищами по работе;Z56.4;59637
10059570;Проблема разногласий с учителями;Z55.4;59638
10059571;Проблема разногласий с хозяином;Z59.2;59639
10059572;Проблема разногласий с хозяином дома;Z59.2;59640
10059573;Проблема разногласий с хозяином квартиры;Z59.2;59641
10059574;Проблема разногласий с членами семьи;Z63.8;59642
10059575;Проблема разногласий с членами семьи уточненная;Z63.9;59643
10059576;Проблема расовой дискриминации;Z60.5;59644
10059577;Проблема расстройства идентификации;F93.8;59645
10059578;Проблема расстройства идентификации в детском возрасте;F93.8;59646
10059579;Проблема расстройства личности;F61;59647
10059580;Проблема расстройства поведения;F69;59648
10059581;Проблема расстройства поведения у взрослого;F69;59649
10059582;Проблема расстройства речи;F80.9;59650
10059583;Проблема расстройства эмоциональным в детстве;F93.8;59651
10059584;Проблема религиозной дискриминации;Z60.5;59652
10059585;Проблема рискованного сексуального поведения;Z72.5;59653
10059586;Проблема сексуального насилия со стороны не члена семьи в детстве;Z61.5;59654
10059587;Проблема сексуального насилия со стороны члена семьи в детстве;Z61.4;59655
10059588;Проблема сексуального насилия, якобы имевшее место со стороны не члена семьи в детстве;Z61.5;59656
10059589;Проблема сексуального насилия, якобы имевшее место со стороны члена семьи в детстве;Z61.4;59657
10059590;Проблема семьи;Z63.9;59658
10059591;Проблема склонности к азартным играм и пари;Z72.6;59659
10059592;Проблема со зрением;H54.7;59660
10059593;Проблема социального окружения;Z60.9;59661
10059594;Проблема социального окружения уточненная;Z60.8;59662
10059595;Проблема социальной изоляции и остракизма;Z60.4;59663
10059596;Проблема терапевтической помощи в семье;Z63.6;59664
10059597;Проблема терапевтической помощи уточненная;Z75.8;59665
10059598;Проблема трудностей принятия другой культуры;Z60.3;59666
10059599;Проблема тюремного заключения;Z65.1;59667
10059600;Проблема тяжелых условий труда;Z56.5;59668
10059601;Проблема угрозы лишиться работы;Z56.2;59669
10059602;Проблема употребления алкоголя;Z72.1;59670
10059603;Проблема употребления наркотиков;Z72.2;59671
10059604;Проблема усыновления ребенка;Z63.8;59672
10059605;Проблема уточненная;Z72.8;59673
10059606;Проблема уточненная, связанная с экономическими обстоятельствами;Z59.8;59674
10059607;Проблема утраты любимого родственника в детстве;Z61.0;59675
10059608;Проблема утраты самоуважения в детстве;Z61.3;59676
10059609;Проблема физического насилия в детстве;Z61.6;59677
10059610;Проблема физического насилия, якобы имевшего место в детстве;Z61.6;59678
10059611;Проблема финансовая;Z59.9;59679
10059612;Проблема финансовая уточненная;Z59.8;59680
10059613;Проблема экономическая;Z59.9;59681
10059614;Проблема экономическая уточненная;Z59.8;59682
10059615;Проблема экономическая, связанная с конфликтом с социальным работником;Z64.4;59683
10059616;Проблема этнической дискриминации;Z60.5;59684
10059617;Проблема, связанная с адаптацией к изменению образа жизни;Z60.0;59685
10059618;Проблема, связанная с алкоголизмом в семье;Z63.7;59686
10059619;Проблема, связанная с банкротством;Z59.8;59687
10059620;Проблема, связанная с взаимоотношениями родителя и ребенка;Z61.9;59688
10059621;Проблема, связанная с вкусовыми ощущениями;R43.8;59689
10059622;Проблема, связанная с внутрисемейным общением;Z63.8;59690
10059623;Проблема, связанная с воспитанием ребенка;Z62.9;59691
10059624;Проблема, связанная с воспитанием ребенка уточненная;Z62.8;59692
10059625;Проблема, связанная с воспитанником;Z63.8;59693
10059626;Проблема, связанная с вредными привычками при приеме пищи;Z72.4;59694
10059627;Проблема, связанная с выбором профессии;Z56.7;59695
10059628;Проблема, связанная с выбором работы;Z56.7;59696
10059629;Проблема, связанная с гениталиями у женщин;N94.9;59697
10059630;Проблема, связанная с гениталиями у мужчин;N50.9;59698
10059631;Проблема, связанная с глазами;H57.9;59699
10059632;Проблема, связанная с глазом;H57.9;59700
10059633;Проблема, связанная с глотанием;R13;59701
10059634;Проблема, связанная с грамотностью;Z55.9;59702
10059635;Проблема, связанная с грамотностью уточненная;Z55.8;59703
10059636;Проблема, связанная с графиком работы;Z56.3;59704
10059637;Проблема, связанная с графиком работы вызывающим стресс;Z56.3;59705
10059638;Проблема, связанная с группой первичной поддержки;Z63.9;59706
10059639;Проблема, связанная с группой первичной поддержки уточненная;Z63.8;59707
10059640;Проблема, связанная с другими видами ухода за больным;Z75.9;59708
10059641;Проблема, связанная с жалобами, вызванными страхом болезни;Z71.1;59709
10059642;Проблема, связанная с жалобами, вызванными страхом болезни при отсутствии диагностированной болезни;Z71.1;59710
10059643;Проблема, связанная с жеванием;K08.8;59711
10059644;Проблема, связанная с жизненными трудностями;Z73.9;59712
10059645;Проблема, связанная с жизненными трудностями уточненная;Z73.8;59713
10059646;Проблема, связанная с жилищными условиями;Z59.9;59714
10059647;Проблема, связанная с изменением семейных взаимоотношений родственников в детстве;Z61.2;59715
10059648;Проблема, связанная с изолированностью;Z59.8;59716
10059649;Проблема, связанная с конфликтом с должностным лицом, надзирающим за испытуемым;Z64.4;59717
10059650;Проблема, связанная с конфликтом с начальником;Z56.4;59718
10059651;Проблема, связанная с конфликтом с официальным поручителем;Z64.4;59719
10059652;Проблема, связанная с конфликтом с партнером;Z63.0;59720
10059653;Проблема, связанная с конфликтом с попечителем;Z64.4;59721
10059654;Проблема, связанная с конфликтом с поручителем;Z64.4;59722
10059655;Проблема, связанная с конфликтом с постояльцами;Z59.2;59723
10059656;Проблема, связанная с конфликтом с работодателем;Z56.4;59724
10059657;Проблема, связанная с конфликтом с родителями жены;Z63.1;59725
10059658;Проблема, связанная с конфликтом с родителями мужа;Z63.1;59726
10059659;Проблема, связанная с конфликтом с родственниками жены;Z63.1;59727
10059660;Проблема, связанная с конфликтом с родственниками мужа;Z63.1;59728
10059661;Проблема, связанная с конфликтом с семьей;Z63.8;59729
10059662;Проблема, связанная с конфликтом с советником;Z64.4;59730
10059663;Проблема, связанная с конфликтом с соседями;Z59.2;59731
10059664;Проблема, связанная с конфликтом с сослуживцами;Z56.4;59732
10059665;Проблема, связанная с конфликтом с соучениками;Z55.4;59733
10059666;Проблема, связанная с конфликтом с социальным работником;Z64.4;59734
10059667;Проблема, связанная с конфликтом с супругом;Z63.0;59735
10059668;Проблема, связанная с конфликтом с товарищами по работе;Z56.4;59736
10059669;Проблема, связанная с конфликтом с учителями;Z55.4;59737
10059670;Проблема, связанная с конфликтом с хозяином;Z59.2;59738
10059671;Проблема, связанная с конфликтом с хозяином дома;Z59.2;59739
10059672;Проблема, связанная с конфликтом с хозяином квартиры;Z59.2;59740
10059673;Проблема, связанная с конфликтом с членами семьи;Z63.8;59741
10059674;Проблема, связанная с конфликтом с членами семьи уточненная;Z63.9;59742
10059675;Проблема, связанная с кормлением;R63.3;59743
10059676;Проблема, связанная с кормлением новорожденного;P92.9;59744
10059677;Проблема, связанная с кормлением новорожденного грудью;P92.5;59745
10059678;Проблема, связанная с кормлением новорожденного уточненная;P92.8;59746
10059679;Проблема, связанная с кормлением новорожденного, медленное вялое сосание;P92.2;59747
10059680;Проблема, связанная с кормлением новорожденного, медленное сосание;P92.2;59748
10059681;Проблема, связанная с кормлением новорожденного, недокармливание;P92.3;59749
10059682;Проблема, связанная с кормлением новорожденного, перекармливание;P92.4;59750
10059683;Проблема, связанная с кредиторами;Z59.8;59751
10059684;Проблема, связанная с курением табака;Z72.0;59752
10059685;Проблема, связанная с медицинскими учреждениями;Z75.9;59753
10059686;Проблема, связанная с медицинскими учреждениями уточненная;Z75.8;59754
10059687;Проблема, связанная с медицинской помощью в семье;Z63.6;59755
10059688;Проблема, связанная с медицинской помощью уточненная;Z75.8;59756
10059689;Проблема, связанная с многодетностью;Z64.1;59757
10059690;Проблема, связанная с нарушением процесса развития;F81.9;59758
10059691;Проблема, связанная с нарушенной способностью передвигаться;Z74.0;59759
10059692;Проблема, связанная с нарушенной способностью передвигаться, требующая оказания помощи;Z74.0;59760
10059693;Проблема, связанная с насилием по отношению к ребенку;Z61.6;59761
10059694;Проблема, связанная с неадекватным обучением;Z55.8;59762
10059695;Проблема, связанная с неблагоприятными жизненными событиями в детстве;Z61.9;59763
10059696;Проблема, связанная с неграмотностью;Z55.0;59764
10059697;Проблема, связанная с нежелательной беременностью;Z64.0;59765
10059698;Проблема, связанная с неприемлемым давлением со стороны родителей;Z62.6;59766
10059699;Проблема, связанная с несоблюдением личной гигиены;Z91.2;59767
10059700;Проблема, связанная с неспособностью к обучению;F81.9;59768
10059701;Проблема, связанная с нетипичными ситуациями между родителями и детьми;Z60.1;59769
10059702;Проблема, связанная с неудобным графиком работы;Z56.3;59770
10059703;Проблема, связанная с неудовлетворенностью работой;Z56.7;59771
10059704;Проблема, связанная с неудовлетворенностью школьной обстановкой;Z55.4;59772
10059705;Проблема, связанная с неудовлетворительными жилищными условиями;Z59.9;59773
